{
  "epodId": "e1f2c3d4-5678-1234-9abc-1234567890ab",
  "orderId": "a1b2c3d4-e5f6-7890-1234-567890abcdef",
  "timestamp": "2024-06-10T12:05:00Z",
  "userId": "john_doe",
  "signature": "data:image/png;base64,iVBORw0KGgoAAAANSUhEUgAA...",
  "photos": [
    "data:image/jpeg;base64,/9j/4AAQSkZJRgABAQAAAQABAAD...",
    "data:image/jpeg;base64,/9j/4AAQSkZJRgABAQAAAQABAAD..."
  ],
  "location": {
    "lat": 52.406374,
    "lng": 16.9251681
  },
  "note": "Dostawa bez uwag, zdjÄ™cie podpisu i paczki."
}
